{
  "schema_version": "0.1.0",
  "evidence_id": "EXAMPLE-EML-20230420",
  "source": {
    "kind": "email/rfc822",
    "filename": "2023_04_20_-_08_18_-_CAF8B92E_-_MAIL_RE3_FWD1_-_Antrag_Familienhilfe_-_lbloemer@stadtdo.de.eml",
    "byte_length": 15818,
    "hashes": {
      "crc32": "7e8ea516",
      "md5": "532bb914be80171ae241259aafd75730",
      "sha1": "c101f2e7e93d474aa52afdeb59efde1a67a02821",
      "sha256": "a43a6b94fc78f162795e608cf3303394b4e2c780e6acdc2faeb5957f29b58d16",
      "sha512": "0745ce2a25bf676ebba23be166f9660f43e9663519b36f7cca9b39449b264bb20018d6c521fb96e9e976c6291330e0e5d89f68b084b99fd751d950bd5b0ef3dd"
    }
  },
  "email": {
    "envelope": {
      "return_path": "<prvs=7474414084=lbloemer@stadtdo.de>",
      "delivered_to": "kristibelnikolova@gmail.com"
    },
    "message": {
      "message_id": "<OF51C48196.167018D7-ONC1258997.002D757C-C1258997.002DA269@stadtdo.de>",
      "subject": "Antwort: Re: Re: Fwd: Antrag Familienhilfe",
      "date_raw": "Thu, 20 Apr 2023 10:18:26 +0200",
      "date_iso": "2023-04-20T08:18:26.000Z",
      "from": [
        {
          "name": null,
          "address": "lbloemer@stadtdo.de"
        }
      ],
      "to": [
        {
          "name": null,
          "address": "kristibelnikolova@gmail.com"
        }
      ],
      "cc": [
        {
          "name": null,
          "address": "bahceci@schoepper-und-kollegen.de"
        },
        {
          "name": null,
          "address": "kontakt@institut-bartoschek.de"
        }
      ],
      "bcc": [],
      "reply_to": [],
      "participants": [
        "lbloemer@stadtdo.de",
        "kristibelnikolova@gmail.com",
        "bahceci@schoepper-und-kollegen.de",
        "kontakt@institut-bartoschek.de"
      ]
    },
    "thread": {
      "in_reply_to": [
        "<CANozcoPEqBa=tBt-Fc2Y4W=3bksuOqvFjSfSbnYXnyg1XgbaRQ@mail.gmail.com>"
      ],
      "references": [
        "<CANozcoNys9XJszVUNk=iGpZvc+VmTTO6qc_v8AkCs7J1S6NMDQ@mail.gmail.com>",
        "<CANozcoN=r2n=XCJ5sB2PULWQ6qwL7cN10Wk-nz0JB-bbovUpig@mail.gmail.com>",
        "<OF78B6D46C.B35822DE-ONC1258994.002EC1B6-C1258994.002EE843@stadtdo.de>",
        "<CANozcoNNocbZvxfq9VGp_Vbf1gUTbZr8xFVFgnvV4EoE8bab0g@mail.gmail.com>",
        "<OFBB8B2EFF.B67FF5A0-ONC1258994.0033C0C9-C1258994.003402E0@stadtdo.de>",
        "<CANozcoPEqBa=tBt-Fc2Y4W=3bksuOqvFjSfSbnYXnyg1XgbaRQ@mail.gmail.com>"
      ],
      "quoted": {
        "messages": [
          {
            "source": "quoted-body",
            "from": "\"Kristi Belnikolova\" <kristibelnikolova@gmail.com>",
            "to": "lbloemer@stadtdo.de, kontakt@institut-bartoschek.de,",
            "date": "17.04.2023 11:40",
            "subject": "Re: Re: Fwd: Antrag Familienhilfe",
            "start_line": 25
          },
          {
            "source": "quoted-body",
            "from": "\"Kristi Belnikolova\" <kristibelnikolova@gmail.com>",
            "to": "lbloemer@stadtdo.de, kontakt@institut-bartoschek.de,",
            "date": "17.04.2023 10:41",
            "subject": "Re: Fwd: Antrag Familienhilfe",
            "start_line": 75
          },
          {
            "source": "quoted-body",
            "from": "\"Kristi Belnikolova\" <kristibelnikolova@gmail.com>",
            "to": "bahceci@schoepper-und-kollegen.de,",
            "date": "05.04.2023 09:12",
            "subject": "Fwd: Antrag Familienhilfe",
            "start_line": 136
          },
          {
            "source": "quoted-body",
            "from": "Kristi Belnikolova <kristibelnikolova@gmail.com>",
            "to": "<lbloemer@stadtdo.de>, <kontakt@institut-bartoschek.de>, <",
            "date": "пт, 31.03.2023 г., 13:38 ч.",
            "subject": "Antrag Familienhilfe",
            "start_line": 222
          }
        ],
        "forwarded_markers": [
          {
            "line": 221,
            "marker": "---------- Forwarded message ---------"
          }
        ]
      }
    },
    "transport": {
      "received": [
        {
          "index": 0,
          "raw": "by 2002:aa6:c3a8:0:b0:258:b864:78 with SMTP id a8csp231886lkq; Thu, 20 Apr 2023 01:18:27 -0700 (PDT)",
          "from": null,
          "by": "2002:aa6:c3a8:0:b0:258:b864:78",
          "ip_addresses": [],
          "id": "a8csp231886lkq",
          "protocol": "SMTP",
          "tls": null,
          "timestamp_raw": "Thu, 20 Apr 2023 01:18:27 -0700 (PDT)",
          "timestamp_iso": "2023-04-20T08:18:27.000Z"
        },
        {
          "index": 1,
          "raw": "from domgate01.stadtdo.de (mail.stadtdo.de. [45.82.172.40]) by mx.google.com with ESMTPS id m5-20020a7bce05000000b003ee4d160f3csi3138990wmc.212.2023.04.20.01.18.27 for <kristibelnikolova@gmail.com> (version=TLS1_2 cipher=ECDHE-ECDSA-AES128-GCM-SHA256 bits=128/128); Thu, 20 Apr 2023 01:18:27 -0700 (PDT)",
          "from": "domgate01.stadtdo.de",
          "by": "mx.google.com",
          "ip_addresses": [
            "45.82.172.40"
          ],
          "id": "m5-20020a7bce05000000b003ee4d160f3csi3138990wmc.212.2023.04.20.01.18.27",
          "protocol": "ESMTPS",
          "tls": {
            "version": "TLS1_2",
            "cipher": "ECDHE-ECDSA-AES128-GCM-SHA256",
            "bits": "128/128"
          },
          "timestamp_raw": "Thu, 20 Apr 2023 01:18:27 -0700 (PDT)",
          "timestamp_iso": "2023-04-20T08:18:27.000Z"
        },
        {
          "index": 2,
          "raw": "from domgate0.stadtdo.de ( [172.18.118.133]) by domgate01.stadtdo.de (DO) with SMTP id DA.C8.03368.355F0446; Thu, 20 Apr 2023 10:18:27 +0200 (CEST)",
          "from": "domgate0.stadtdo.de",
          "by": "domgate01.stadtdo.de",
          "ip_addresses": [
            "172.18.118.133"
          ],
          "id": "DA.C8.03368.355F0446",
          "protocol": "SMTP",
          "tls": null,
          "timestamp_raw": "Thu, 20 Apr 2023 10:18:27 +0200 (CEST)",
          "timestamp_iso": "2023-04-20T08:18:27.000Z"
        },
        {
          "index": 3,
          "raw": "from bkpvps02.stadtdo.de (bkpvps02.stadtdo.de [172.30.14.53]) by domgate0.stadtdo.de (Postfix) with ESMTP id 536A74A014; Thu, 20 Apr 2023 10:18:27 +0200 (CEST)",
          "from": "bkpvps02.stadtdo.de",
          "by": "domgate0.stadtdo.de",
          "ip_addresses": [
            "172.30.14.53"
          ],
          "id": "536A74A014",
          "protocol": "ESMTP",
          "tls": null,
          "timestamp_raw": "Thu, 20 Apr 2023 10:18:27 +0200 (CEST)",
          "timestamp_iso": "2023-04-20T08:18:27.000Z"
        },
        {
          "index": 4,
          "raw": "from bkpvps02.stadtdo.de (localhost.localdomain [127.0.0.1]) by bkpvps02.stadtdo.de (Postfix) with ESMTPS id 2D79AA013E; Thu, 20 Apr 2023 10:18:27 +0200 (CEST)",
          "from": "bkpvps02.stadtdo.de",
          "by": "bkpvps02.stadtdo.de",
          "ip_addresses": [
            "127.0.0.1"
          ],
          "id": "2D79AA013E",
          "protocol": "ESMTPS",
          "tls": null,
          "timestamp_raw": "Thu, 20 Apr 2023 10:18:27 +0200 (CEST)",
          "timestamp_iso": "2023-04-20T08:18:27.000Z"
        },
        {
          "index": 5,
          "raw": "from domint1.stadtdo.de (bknginx01.stadtdo.de [172.30.14.56]) by bkpvps02.stadtdo.de (Postfix) with ESMTPS id 2929FA00A1; Thu, 20 Apr 2023 10:18:27 +0200 (CEST)",
          "from": "domint1.stadtdo.de",
          "by": "bkpvps02.stadtdo.de",
          "ip_addresses": [
            "172.30.14.56"
          ],
          "id": "2929FA00A1",
          "protocol": "ESMTPS",
          "tls": null,
          "timestamp_raw": "Thu, 20 Apr 2023 10:18:27 +0200 (CEST)",
          "timestamp_iso": "2023-04-20T08:18:27.000Z"
        }
      ],
      "hop_count": 6
    },
    "authentication": {
      "authentication_results": [
        {
          "index": 0,
          "raw": "mx.google.com; dkim=pass header.i=@stadtdo.de header.s=20160127domcon01 header.b=Nx4HkSmz; spf=pass (google.com: domain of prvs=7474414084=lbloemer@stadtdo.de designates 45.82.172.40 as permitted sender) smtp.mailfrom=\"prvs=7474414084=lbloemer@stadtdo.de\"; dmarc=pass (p=NONE sp=NONE dis=NONE) header.from=stadtdo.de",
          "results": [
            {
              "mechanism": "dkim",
              "result": "pass",
              "details": "header.i=@stadtdo.de header.s=20160127domcon01 header.b=Nx4HkSmz"
            },
            {
              "mechanism": "spf",
              "result": "pass",
              "details": "(google.com: domain of prvs=7474414084=lbloemer@stadtdo.de designates 45.82.172.40 as permitted sender) smtp.mailfrom=\"prvs=7474414084=lbloemer@stadtdo.de\""
            },
            {
              "mechanism": "dmarc",
              "result": "pass",
              "details": "(p=NONE sp=NONE dis=NONE) header.from=stadtdo.de"
            }
          ]
        }
      ],
      "arc_authentication_results": [
        {
          "index": 0,
          "raw": "i=1; mx.google.com; dkim=pass header.i=@stadtdo.de header.s=20160127domcon01 header.b=Nx4HkSmz; spf=pass (google.com: domain of prvs=7474414084=lbloemer@stadtdo.de designates 45.82.172.40 as permitted sender) smtp.mailfrom=\"prvs=7474414084=lbloemer@stadtdo.de\"; dmarc=pass (p=NONE sp=NONE dis=NONE) header.from=stadtdo.de",
          "results": [
            {
              "mechanism": "dkim",
              "result": "pass",
              "details": "header.i=@stadtdo.de header.s=20160127domcon01 header.b=Nx4HkSmz"
            },
            {
              "mechanism": "spf",
              "result": "pass",
              "details": "(google.com: domain of prvs=7474414084=lbloemer@stadtdo.de designates 45.82.172.40 as permitted sender) smtp.mailfrom=\"prvs=7474414084=lbloemer@stadtdo.de\""
            },
            {
              "mechanism": "dmarc",
              "result": "pass",
              "details": "(p=NONE sp=NONE dis=NONE) header.from=stadtdo.de"
            }
          ]
        }
      ],
      "received_spf": [
        {